title,award_value,number_of_awards,competition_to_apply,donor,award_description,required_criteria,year_entering,award_information
A.W.R. Carrothers Memorial Bursary in Law,1500,1,Law Awards,"Family and friends in memory of Dr. A.W.R. Carrothers,","Offered annually to a student entering first year in the Faculty of Law, JD program; Academic merit; Financial need.","{""Student type"": ""Professional"", ""Citizenship/residency"": ""Any"", ""Faculty"": ""Law""}",1,"{""Type of award"": ""Bursary"", ""Internal/external/government"": ""Internal""}"
Adam Richard Leinweber Entrance Scholarship,10000,1,High School Awards,"Leinweber Family, Jay Todesco, Tecumseh TaeKwon-Do","Offered annually to an undergraduate student entering the Faculty of Science, majoring in Physics; Academic merit","{""Student type"": ""Undergraduate"", ""Citizenship/residency"": ""Any"", ""Faculty"": ""Science"", ""Major"": ""N/A""}",1,"{""Type of award"": ""Scholarship"", ""Internal/external/government"": ""Internal""}"
Alberta Union of Provincial Employees Entrance Bursary,700,1,High School Awards,Alberta Union of Provincial Employees,"Offered annually to an undergraduate student entering first year in any faculty; Financial need; Academic merit; Member in good standing (two consecutive years of service) of the Alberta Union of Provincial Employees or the sons, daughters, legal wards or spouses. Dependent of retired or deceased member within a period of 10 years of retirement or death of the member. Dependent must be under the age of 25.","{""Student type"": ""Undergraduate"", ""Citizenship/residency"": ""Any"", ""Faculty"": ""Any""}",1,"{""Type of award"": ""Bursary"", ""Internal/external/government"": ""Internal""}"
Aisling Wall Memorial Bursary,1200,1,Continuing Undergraduate Awards Competition,"Friends, family and former colleagues of Aisling Wall","Offered annually to a continuing undergraduate student entering third year in the School of Languages, Linguistics, Literatures and Cultures, majoring in East Asian Language Studies, East Asian Studies, German or Russian; Academic merit; Financial need.","{""Student type"": ""Undergraduate"", ""Citizenship/residency"": ""Any"", ""Faculty"": ""Arts"", ""Major"": ""N/A""}",3,"{""Type of award"": ""Bursary"", ""Internal/external/government"": ""Internal""}"
Alastair H. Ross Memorial Scholarship,6100,2,Continuing Undergraduate Awards Competition,Mrs. Joan Ross and family and friends of Alastair H. Ross,Offered annually to continuing undergraduate students in the Haskayne School of Business in the Bachelor of Commerce/Bachelor of Science (Computer Science) combined degree program; Academic merit; Extra-curricular activities demonstrating community service,"{""Student type"": ""Undergraduate"", ""Citizenship/residency"": ""Any"", ""Faculty"": ""Business"", ""Major"": ""N/A""}","2, 3, 4","{""Type of award"": ""Scholarship"", ""Internal/external/government"": ""Internal""}"
A Footprint in the Sand Bursary,1750,2,Continuing Undergraduate Awards Competition,Anonymous donation,Offered annually to continuing undergraduate students majoring in English. Registered full-time but need not be carrying a full course load; Academic merit; Financial need.,"{""Student type"": ""Undergraduate"", ""Citizenship/residency"": ""Any"", ""Faculty"": ""Arts"", ""Major"": ""N/A""}","2, 3, 4","{""Type of award"": ""Bursary"", ""Internal/external/government"": ""Internal""}"
